{
  "schemaVersion": 1,
  "contract": "kfd.self-conformance-transition-bundle/v1",
  "profile": "kfd-self-conformance@1.0.0-alpha.1",
  "bundleId": "federated-work-continuity-first-cycle-genesis",
  "transition": "candidate-genesis",
  "previousState": {
    "schemaVersion": 1,
    "contract": "kfd.self-conformance-state/v1",
    "profile": "kfd-self-conformance@1.0.0-alpha.1",
    "subject": {
      "id": "kfd-self-conformance-pressure",
      "kind": "pressure-field",
      "number": null
    },
    "semanticState": "absent",
    "publicationState": "unpublished",
    "immutableCoordinates": {
      "repository": "https://github.com/kungfu-systems/kfd",
      "commit": "a219407a45f43bfec1dba9df72b4469424aa4b19",
      "path": "drafts/registry.json",
      "contentRoot": "sha256:7e6eeaca3d3c84aacba04af72b447a9778c93b97883854c174d03f609d4ffea1",
      "packageVersion": "1.0.0-alpha.55",
      "packageRoot": "sha256:114c195fea83c65ec84e52def6c2afced8a4ca9d2c9abe813f5c9c5d3b50260a"
    }
  },
  "previousStateRoot": "sha256:dee2c0c23b30ab37395b548af698bf9800a9b33ebcba5efdf34c7c250ebf1049",
  "proposedState": {
    "schemaVersion": 1,
    "contract": "kfd.self-conformance-state/v1",
    "profile": "kfd-self-conformance@1.0.0-alpha.1",
    "subject": {
      "id": "kfd-self-conformance-pressure",
      "kind": "pressure-field",
      "number": null
    },
    "semanticState": "candidate",
    "publicationState": "unpublished",
    "immutableCoordinates": {
      "repository": "https://github.com/kungfu-systems/kfd",
      "commit": "3835eff362c05f0389ee913196a3dc46cc8767a9",
      "path": "evidence/self-conformance/qualification/federated-work-continuity-first-cycle.pressure.json",
      "contentRoot": "sha256:414b5ae7b5afeae114780b8509b2780b836025e9c60618e2a0d71ec5e9c72aa3"
    }
  },
  "proposedStateRoot": "sha256:4e9a9c58ed35d24095249536a9065503a267ff6e7f1d6d93f766dae737b95e82",
  "predecessor": {
    "kind": "bootstrap",
    "bootstrapAnchorRoot": "sha256:26961922619d090faf9c76f8bf0e25947100a5d13be6831366f1a0933c7ced59",
    "reportRoot": null,
    "packageRoot": "sha256:114c195fea83c65ec84e52def6c2afced8a4ca9d2c9abe813f5c9c5d3b50260a"
  },
  "evidenceRoots": [
    "sha256:dc0df003aba75c8dcabba33e8bcb17dc57b0d967f8bc442267a8d49ae77557cc"
  ],
  "schemaSetRoot": "sha256:8def5dbde4cb0659f8d913c4145c4373fe031022158d5bbdc0db0bdb177fc45b",
  "verifierRoot": "sha256:ec577004be9f0d30ce69a60a30979767489a86fb5c47d32393a8ca76b840e9aa",
  "authorityReceiptRoot": "sha256:01f45c5b3e27e5dc889cfd234fe496923fa929faf6ceb60af969d14a2f811f36",
  "reviewReceiptRoot": "sha256:44a769c62376e0e6d9276f114ef4e31d5b92c8e476603ebd27e5af1ad1e394cf",
  "claimBoundary": "This bundle records structural evidence for one bounded dogfood transition only; no semantic truth, certification, adoption, numbering, status, approval, merge, or release authority is claimed.",
  "knownGaps": [
    "No measured reconstruction-cost comparison selects stable entity, derived view, or no-new-Primitive semantics.",
    "No qualified non-software or structurally non-isomorphic adopter comparison is retained.",
    "The deletion and fuse witnesses remain analytic or inconclusive rather than independently reproduced.",
    "The founding implementation is product evidence and cannot serve as normative authority."
  ],
  "expectedResult": "pass",
  "immutableCoordinates": [
    {
      "kind": "document",
      "value": "evidence/self-conformance/qualification/federated-work-continuity-first-cycle.pressure.json#sha256:414b5ae7b5afeae114780b8509b2780b836025e9c60618e2a0d71ec5e9c72aa3",
      "root": "sha256:414b5ae7b5afeae114780b8509b2780b836025e9c60618e2a0d71ec5e9c72aa3"
    }
  ]
}
