{
  "schemaVersion": 1,
  "contract": "kfd.self-conformance-transition-bundle/v1",
  "profile": "kfd-self-conformance@1.0.0-alpha.1",
  "bundleId": "example-candidate-qualification",
  "transition": "candidate-qualification",
  "previousState": {
    "schemaVersion": 1,
    "contract": "kfd.self-conformance-state/v1",
    "profile": "kfd-self-conformance@1.0.0-alpha.1",
    "subject": {
      "id": "kfd-self-conformance-pressure",
      "kind": "pressure-field",
      "number": null
    },
    "semanticState": "candidate",
    "publicationState": "unpublished",
    "immutableCoordinates": {
      "repository": "https://example.invalid/kfd-clean-room",
      "commit": "ffffffffffffffffffffffffffffffffffffffff",
      "path": "candidates/self-conformance.md",
      "contentRoot": "sha256:1111111111111111111111111111111111111111111111111111111111111111"
    }
  },
  "previousStateRoot": "sha256:0e7a9a8abbfa7febc283df3b46afdc5c1ffdd626f460078840db29dea4244082",
  "proposedState": {
    "schemaVersion": 1,
    "contract": "kfd.self-conformance-state/v1",
    "profile": "kfd-self-conformance@1.0.0-alpha.1",
    "subject": {
      "id": "kfd-self-conformance-pressure",
      "kind": "pressure-field",
      "number": null
    },
    "semanticState": "qualified",
    "publicationState": "unpublished",
    "immutableCoordinates": {
      "repository": "https://example.invalid/kfd-clean-room",
      "commit": "ffffffffffffffffffffffffffffffffffffffff",
      "path": "candidates/self-conformance.md",
      "contentRoot": "sha256:1111111111111111111111111111111111111111111111111111111111111111"
    }
  },
  "proposedStateRoot": "sha256:8bb097b79ef9adde7178156d2a47b00ffe85cb7efef026538607ff606db7ece0",
  "predecessor": {
    "kind": "report",
    "bootstrapAnchorRoot": null,
    "reportRoot": "sha256:6666666666666666666666666666666666666666666666666666666666666666",
    "packageRoot": "sha256:7777777777777777777777777777777777777777777777777777777777777777"
  },
  "evidenceRoots": [
    "sha256:b5ab736d335f4dbf791a5e81f611940886f96a35bb9d1e4df7e77ba28497cd81"
  ],
  "schemaSetRoot": "sha256:b22ed964f65c9c3abbc3279a6e8a07114f133d42dc118d5eff0817df0314d050",
  "verifierRoot": "sha256:3c89beaa1efdfb8911d97035622b78f72f87709339aaeead5a3c08789e7dcfe0",
  "authorityReceiptRoot": "sha256:3bb5a62394c9acf2b4a27b462ef409e6bca7355951c0b5a825678ddbe869767e",
  "reviewReceiptRoot": "sha256:ece39181a43fd02698807ad2310b4dae56ab2e5e5c7519e7295fa224e3804611",
  "claimBoundary": "Fixture-only structural example; no semantic truth, human approval, certification, adoption, numbering, status, or release authority is claimed.",
  "knownGaps": [
    "The example authority and review receipts are deliberately non-authoritative fixtures."
  ],
  "expectedResult": "pass",
  "immutableCoordinates": [
    {
      "kind": "document",
      "value": "candidates/self-conformance.md@ffffffffffffffffffffffffffffffffffffffff",
      "root": "sha256:1111111111111111111111111111111111111111111111111111111111111111"
    }
  ]
}
